date,id,title,link,published
2025-09-05,oai:arXiv.org:2509.03973v1,SAC-MIL: Spatial-Aware Correlated Multiple Instance Learning for Histopathology Whole Slide Image Classification,https://arxiv.org/abs/2509.03973,"Fri, 05 Sep 2025 00:00:00 -0400"
2025-09-05,oai:arXiv.org:2509.03704v1,QuantV2X: A Fully Quantized Multi-Agent System for Cooperative Perception,https://arxiv.org/abs/2509.03704,"Fri, 05 Sep 2025 00:00:00 -0400"
2025-09-05,oai:arXiv.org:2509.03775v1,"ContraGS: Codebook-Condensed and Trainable Gaussian Splatting for Fast, Memory-Efficient Reconstruction",https://arxiv.org/abs/2509.03775,"Fri, 05 Sep 2025 00:00:00 -0400"
2025-09-05,oai:arXiv.org:2509.04437v1,From Lines to Shapes: Geometric-Constrained Segmentation of X-Ray Collimators via Hough Transform,https://arxiv.org/abs/2509.04437,"Fri, 05 Sep 2025 00:00:00 -0400"
2025-09-05,oai:arXiv.org:2312.03993v2,Style Transfer to Calvin and Hobbes comics using Stable Diffusion,https://arxiv.org/abs/2312.03993,"Fri, 05 Sep 2025 00:00:00 -0400"
2025-09-05,oai:arXiv.org:2509.04379v1,SSGaussian: Semantic-Aware and Structure-Preserving 3D Style Transfer,https://arxiv.org/abs/2509.04379,"Fri, 05 Sep 2025 00:00:00 -0400"
2025-09-05,oai:arXiv.org:2509.04058v1,SMooGPT: Stylized Motion Generation using Large Language Models,https://arxiv.org/abs/2509.04058,"Fri, 05 Sep 2025 00:00:00 -0400"
